{
  "ruleset_version": "1.0",
  "formatting": {
    "brace_style": "allman",
    "indent": "spaces_4",
    "line_ending": "crlf",
    "max_line_length": 160,
    "space_after_control_keyword": true,
    "control_braces_on_new_line": true
  },
  "naming": {
    "identifier_case": "camelCase",
    "hungarian_prefixes": {
      "unsigned char": "uc",
      "char": "c",
      "unsigned short": "us",
      "short": "s",
      "unsigned int": "ui",
      "int": "i",
      "unsigned long": "ul",
      "unsigned long long": "ull",
      "struct": "s",
      "struct_pointer": "sp",
      "pointer_suffix": "p",
      "array_suffix": "Arr",
      "global_prefix": "G_",
      "static_prefix": "S_"
    },
    "typedef_prefixes": {
      "struct": "S",
      "union": "S",
      "enum": "E"
    },
    "function_pattern": "camelCase",
    "function_regex": "^[a-z][A-Za-z0-9]*$",
    "disallowed_types": ["uint8_t", "int8_t", "uint16_t", "int16_t", "uint32_t", "int32_t", "uint64_t", "int64_t"]
  },
  "declarations": {
    "struct_typedef_prefix": "S",
    "union_typedef_prefix": "S",
    "enum_typedef_prefix": "E",
    "bitfield_member_prefix": "",
    "struct_brace_style": "typedef struct newline braces",
    "union_brace_style": "typedef union newline braces",
    "enum_brace_style": "typedef enum newline braces"
  },
  "print_conventions": {
    "line_terminator_in_prints": "\\r\\n"
  },
  "doxygen": {
    "required_on_public_functions": true
  }
}
